{
  "accepted": true,
  "acknowledgement_sent": false,
  "app_id_hash": "cc35137f61dec6586c1b62ca98cd438172853986bb71f725ca389d6e6c28817e",
  "case_completion": false,
  "case_creation": false,
  "completion_status": "COMPLETED",
  "credentials_required": false,
  "customer_receipt_verified": false,
  "duplicate_event_count": 2,
  "fake_pairing_verified": true,
  "group_openid_hash": "98378dc6f78aab2f65ba2034fe6e5d236512ff45133113939b205724bffb6725",
  "handler_binding": false,
  "issue_resolution": false,
  "mode": "offline-fake",
  "model_invocation": false,
  "network_required": false,
  "observed_event_count": 1,
  "pairing_id": "qqpair_959e4d33084a4171c85b58b8c3b0cd47",
  "privacy": {
    "challenge_plaintext_persisted": false,
    "credential_persisted": false,
    "member_identity_persisted": false,
    "provider_event_persisted": false,
    "raw_group_in_report": false
  },
  "production_ready": false,
  "qq_group_pairing_live_verified": false,
  "qq_write_attempted": false,
  "reason_code": "pairing_exact_challenge_completed",
  "rejected_event_count": 7,
  "report_id": "qqpr_da3d972898420e30ea2a5ed4d1914039",
  "report_sha256": "a6af49f2a18ec2e0ed855d90bdb92be1fbdbef0421f0f06d63fb45f8c3dd677a",
  "schema_id": "https://weflow.local/contracts/v1/qq-group-pairing-acceptance-report.schema.json",
  "schema_version": "v1",
  "stage1_verified": false,
  "tenant_id_hash": "c47b0b7ae263586d1f2128f7b048f5e39aa0cd54e2ea699cb0f7079d737d1ac9",
  "workflow_activation": false
}
