{
  "accepted": true,
  "acknowledgement_sent": false,
  "app_id_hash": "e76414adc0d1ec491216b7268d46629646e435217e3d889aaee51a6ce304bdfa",
  "case_completion": false,
  "case_creation": false,
  "completion_status": "COMPLETED",
  "credentials_required": true,
  "customer_receipt_verified": false,
  "duplicate_event_count": 0,
  "fake_pairing_verified": false,
  "group_openid_hash": "d8a466c8ee8cee3672aefcc11214f84b773de903f7f9ffe8264455a0d62e3ed1",
  "handler_binding": false,
  "issue_resolution": false,
  "mode": "qq-sandbox-live",
  "model_invocation": false,
  "network_required": true,
  "observed_event_count": 1,
  "pairing_id": "qqpair_d450e2c542fc51e8b59beacdbffb9505",
  "privacy": {
    "challenge_plaintext_persisted": false,
    "credential_persisted": false,
    "member_identity_persisted": false,
    "provider_event_persisted": false,
    "raw_group_in_report": false
  },
  "production_ready": false,
  "qq_group_pairing_live_verified": true,
  "qq_write_attempted": false,
  "reason_code": "pairing_exact_challenge_completed",
  "rejected_event_count": 0,
  "report_id": "qqpr_4b072fcb4923cd001111f5bac9c972cc",
  "report_sha256": "a90e462c98a92186a1a458616dfa37179f839d1fd1574781d353099f3710577a",
  "schema_id": "https://weflow.local/contracts/v1/qq-group-pairing-acceptance-report.schema.json",
  "schema_version": "v1",
  "stage1_verified": false,
  "tenant_id_hash": "0811ff50336d778e5fc2042247a920ae40ea274b6620fb2b1739173b6d2662f3",
  "workflow_activation": false
}
